{
  "$schema": "https://json-schema.org/draft/2020-12/schema",
  "$id": "https://github.com/lenhonbp/MotionLoom/blob/main/schemas/export-manifest.schema.json",
  "title": "MotionLoom artifact export manifest",
  "description": "Binds an output set to its receipt and control track for downstream runtime and Dev Lab evidence. It does not certify production readiness.",
  "type": "object",
  "additionalProperties": false,
  "required": ["schema_version", "manifest_id", "asset_id", "receipt_ref", "control_track_ref", "outputs", "created_at"],
  "properties": {
    "schema_version": {"const": "0.1"},
    "manifest_id": {"type": "string", "pattern": "^[A-Za-z0-9][A-Za-z0-9._-]{2,127}$"},
    "asset_id": {"type": "string", "minLength": 1},
    "created_at": {"type": "string", "format": "date-time"},
    "receipt_ref": {"type": "string", "pattern": "^(?!/)(?!.*(?:^|/)\\.\\.(?:/|$)).+"},
    "control_track_ref": {"type": "string", "pattern": "^(?!/)(?!.*(?:^|/)\\.\\.(?:/|$)).+"},
    "runtime_evidence_ref": {"type": "string", "pattern": "^(?!/)(?!.*(?:^|/)\\.\\.(?:/|$)).+"},
    "outputs": {"type": "array", "minItems": 1, "items": {"type": "object", "additionalProperties": false, "required": ["path", "role", "sha256", "bytes", "target"], "properties": {"path": {"type": "string", "pattern": "^(?!/)(?!.*(?:^|/)\\.\\.(?:/|$)).+"}, "role": {"type": "string", "minLength": 1}, "sha256": {"type": "string", "pattern": "^[a-f0-9]{64}$"}, "bytes": {"type": "integer", "minimum": 0}, "target": {"type": "string", "enum": ["runtime_candidate", "preview", "archive"]}}}}
  }
}
