{
  "schema_version": "0.1",
  "manifest_id": "runtime-pilot-framer-export",
  "asset_id": "runtime/framer-motion-pilot",
  "created_at": "2026-08-15T00:00:00Z",
  "receipt_ref": "examples/agent-consumer/runtime-pilot/receipt.json",
  "control_track_ref": "examples/agent-consumer/runtime-pilot/controls.json",
  "outputs": [
    {
      "path": "src/output/runtime-pilot-framer/scene.jsx",
      "role": "runtime-source",
      "sha256": "f4c0e56de842cae6b234566b556e4f07154f8109dde382a474218a9de8b45a8b",
      "bytes": 1769,
      "target": "runtime_candidate"
    }
  ]
}
